{
  "schema_version": "1.0.0",
  "registry_id": "fixer-r1",
  "title": "Fixer R1 portfolio registry",
  "as_of": "2026-07-28",
  "source_snapshot": [
    "FIXER_R1_GRAND_RUN_CHECKLIST.md",
    "Fixer MCP project doc 21: Parallel Wave Lifecycle",
    "Fixer MCP project doc 22: Fixer Studio Desktop Bridge",
    "Fixer MCP project doc 58: Network Pivot",
    "Fixer MCP project doc 64: Economy v0",
    "Fixer MCP project docs 65 and 70: Provider Adapter Abstraction",
    "Fixer MCP project doc 75: Build State and Roadmap",
    "Fixer MCP project doc 81: ShipFlow Tracker MVP",
    "Fixer MCP project doc 85: R1 Mission Control / Roadmap"
  ],
  "runtime_observation_contract": {
    "source_of_truth": "Fixer MCP runtime state",
    "join_key": "feature_id",
    "embedded_runtime_state": false,
    "manual_percentages_allowed": false,
    "observed_entities": [
      "backlog_items",
      "sessions",
      "waves",
      "workers",
      "screenshots",
      "acceptance_runs",
      "deployments",
      "architect_gates"
    ]
  },
  "global_decisions": [
    {
      "id": "DEC-FREE-SELF-HOSTING",
      "decision": "Self-hosted Fixer MCP is fully user-operated and costs exactly $0; payment is never required to run it.",
      "evidence_refs": [
        "FIXER_R1_GRAND_RUN_CHECKLIST.md#non-negotiable-product-decisions"
      ]
    },
    {
      "id": "DEC-OPTIONAL-SUBSCRIPTION",
      "decision": "The Fixer subscription is optional and pays for managed value or entitlements, not access to free self-hosting.",
      "evidence_refs": [
        "FIXER_R1_GRAND_RUN_CHECKLIST.md#non-negotiable-product-decisions"
      ]
    },
    {
      "id": "DEC-EXCHANGE-GOVERNED-OPT-IN",
      "decision": "A creator, then the activated project governance body, decides whether a project joins Fixer Exchange; settlement fees are enforced after opt-in.",
      "evidence_refs": [
        "FIXER_R1_GRAND_RUN_CHECKLIST.md#non-negotiable-product-decisions"
      ]
    },
    {
      "id": "DEC-EXCHANGE-FEE-UNSET",
      "decision": "The Exchange fee rate remains an Architect/legal/unit-economics decision; the former 0% take-rate rule is superseded.",
      "evidence_refs": [
        "FIXER_R1_GRAND_RUN_CHECKLIST.md#non-negotiable-product-decisions"
      ]
    },
    {
      "id": "DEC-GATEWAY-BOUNDARY",
      "decision": "All model and infrastructure consumption, including BYOK, routes through a Fixer gateway for policy, accounting, and budget enforcement.",
      "evidence_refs": [
        "FIXER_R1_GRAND_RUN_CHECKLIST.md#non-negotiable-product-decisions"
      ]
    },
    {
      "id": "DEC-HONEST-MATURITY",
      "decision": "R1 is an end-to-end system whose shipped surfaces are explicitly labelled stable, alpha, or experimental.",
      "evidence_refs": [
        "FIXER_R1_GRAND_RUN_CHECKLIST.md#non-negotiable-product-decisions"
      ]
    },
    {
      "id": "DEC-REAL-WALLET-SIGNATURE",
      "decision": "Every real crypto action requires an explicit operator signature, exact recipient and amount preview, and a hard spend cap.",
      "evidence_refs": [
        "FIXER_R1_GRAND_RUN_CHECKLIST.md#non-negotiable-product-decisions"
      ]
    },
    {
      "id": "DEC-STUDIO-CANONICAL",
      "decision": "Current Fixer Studio is the canonical cockpit; the retired App Server cockpit must not be revived.",
      "evidence_refs": [
        "Fixer MCP project doc 22"
      ]
    },
    {
      "id": "DEC-RUST-TERMINAL",
      "decision": "A new Rust terminal is required, with the Python launcher retained until migration acceptance passes.",
      "evidence_refs": [
        "FIXER_R1_GRAND_RUN_CHECKLIST.md#rust-fixer-terminal"
      ]
    },
    {
      "id": "DEC-PROTECTED-GOVERNANCE",
      "decision": "Economic votes may be unit-weighted, while constitution, mission, publicity, and ownership changes need an additional community protection threshold.",
      "evidence_refs": [
        "FIXER_R1_GRAND_RUN_CHECKLIST.md#public-projects-ownership-and-governance"
      ]
    }
  ],
  "architect_gates": [
    {
      "id": "ARCH-RESTART-001",
      "title": "MCP binary restart and build-epoch confirmation",
      "trigger": "A reviewed control-plane change requires a new Fixer MCP binary.",
      "required_action": "Restart Fixer MCP and explicitly confirm the exact required build from a fresh process.",
      "blocking_scope": "All later wave creation, launch, deferred release, repair, retry, and acceptance dispatch.",
      "evidence_requirement": "Durable required/running build IDs and epochs, distinct process identities, restart confirmation, and explicit orchestration resume."
    },
    {
      "id": "ARCH-WALLET-001",
      "title": "Real-wallet funding and signature",
      "trigger": "The controlled real-SOL transaction is ready with a validated preview and test wallet.",
      "required_action": "Fund the test wallet if needed and sign the exact transaction explicitly.",
      "blocking_scope": "Broadcast of any real crypto transaction.",
      "evidence_requirement": "Recipient, amount, fees, hard cap, simulation result, explicit signature, transaction ID, and reconciliation record."
    },
    {
      "id": "ARCH-EXCHANGE-FEE-001",
      "title": "Exchange settlement fee",
      "trigger": "Exchange settlement implementation needs a concrete fee schedule.",
      "required_action": "Approve fee rate and minimum only after unit-economics and legal review.",
      "blocking_scope": "Production Exchange settlement and public fee claims.",
      "evidence_requirement": "Approved fee schedule, versioned policy, legal review, and enforcement tests."
    },
    {
      "id": "ARCH-PAYMENTS-001",
      "title": "Payment rails and commercial terms",
      "trigger": "A payment or managed-provider integration is ready to leave sandbox/research.",
      "required_action": "Approve the legally available operating entity, merchant path, refund rules, and provider commercial terms.",
      "blocking_scope": "Production charges, recurring billing, and resale of managed model usage.",
      "evidence_requirement": "Current primary-source terms, legal/tax findings, sandbox reconciliation, and signed provider/merchant account decision."
    },
    {
      "id": "ARCH-COMPUTE-001",
      "title": "Compute contracting and geography",
      "trigger": "Fixer is ready to resell or coordinate third-party or contributed compute.",
      "required_action": "Choose direct-customer versus reseller/MoR structure and approve geographic restrictions.",
      "blocking_scope": "Production paid compute and cross-border contributed-resource scheduling.",
      "evidence_requirement": "Provider contracts, sanctions/residency analysis, abuse model, and explicit operator contribution consent."
    },
    {
      "id": "ARCH-GOVERNANCE-001",
      "title": "Public-project legal wrapper",
      "trigger": "On-chain/project units are ready to represent enforceable economic or ownership rights.",
      "required_action": "Approve a legal wrapper and the boundary between on-chain rules and off-chain assets/IP.",
      "blocking_scope": "Claims that units are equity, ownership, or legally enforceable revenue rights.",
      "evidence_requirement": "Jurisdiction-specific legal review, constitution text, risk disclosures, and accepted governance tests."
    },
    {
      "id": "ARCH-BRAND-001",
      "title": "Product name and brand",
      "trigger": "The combined landing and production surfaces are ready for public launch.",
      "required_action": "Approve product name, logo, palette, and positioning.",
      "blocking_scope": "Final branded launch assets and broad public campaign.",
      "evidence_requirement": "Approved brand system and checked desktop, web, manager, and agent-readable applications."
    }
  ],
  "features": [
    {
      "id": "R1-WAVE-001",
      "domain": "control-plane",
      "title": "Wave Engine v2 core lifecycle",
      "summary": "Project-scoped recursive and batched waves with explicit phase, gate, control, failure governance, acceptance, immutable outcomes, and build-epoch restart fencing.",
      "status": "verified",
      "maturity": "alpha",
      "decisions": [
        "Null/zero child depth disables recursion and positive depth decrements through an acyclic root lineage.",
        "Batch launch/wait is project-scoped and additive to the single-wave API.",
        "Failure decisions are backend-enforced; a strict majority pauses and one eligible isolated failure gets at most one governed repair.",
        "Acceptance is distinct from implementation review.",
        "A required build epoch fences dispatch until a fresh matching process confirms it."
      ],
      "dependencies": [],
      "evidence": [
        {
          "kind": "canon",
          "ref": "Fixer MCP project doc 21",
          "note": "Current lifecycle, failure, acceptance, and restart contract."
        },
        {
          "kind": "code",
          "ref": "fixer_mcp/parallel_wave_state.go",
          "note": "Lineage, failure policy, transition, and build-state implementation."
        },
        {
          "kind": "code",
          "ref": "fixer_mcp/parallel_wave_batch_handlers.go",
          "note": "Project-scoped additive batch wrappers."
        },
        {
          "kind": "test",
          "ref": "fixer_mcp/parallel_wave_state_test.go",
          "note": "State, failure, acceptance, and restart coverage."
        },
        {
          "kind": "code",
          "ref": "git:ee1a84a",
          "note": "Reviewed base includes final linearizable restart hardening."
        }
      ],
      "acceptance_criteria": [
        "Validate root lineage, depth, descendant-wave and session ceilings transactionally.",
        "Preserve single-wave behavior while isolating batch item failures.",
        "Block reviewer, repair, retry, acceptance, and child dispatch under paused failure policy.",